"is there any information available on the difference in the effects of various edge conditions on the buckling of cylindrical shells.","887","3","888","3","889","3","843","2","769","0"
"general methods of solving clamped plate problems.","730","2","422","2","648","2","731","1","733","1","734","1","1392","2","735","1","736","1","641","0"
"papers dealing with uniformly loaded sectors.","733","4","734","4","735","4","736","4","641","0"
"in the problem of the buckling strength of uniform circular cylinders loaded in axial compression, does the linear solution help with improving the non-linear one.","739","2","742","2","743","2","642","0"
"find a calculation procedure applicable to all incompressible laminar boundary layer flow problems having good accuracy and reasonable computation time.","1383","3","1385","3","155","2","241","2","1382","2","1370","1","1386","1","111","1","1384","2","150","2","292","2","458","1","479","1","977","1","376","2","459","2","1365","2","62","2","1366","2","1182","0"
"has anyone investigated the shear buckling of stiffened plates.","400","2","419","2","1387","2","412","1","1392","1","1398","1","1397","2","1400","2","1399","1","1396","0"
"what is the heat transfer to a blunt body in the absence of vorticity.","24","4","101","4","666","2","667","2","93","2","1258","1","1393","4","559","2","630","2","662","2","1104","2","1107","2","1204","2","1213","2","1300","2","1191","0"
"what are the general effects on flow fields when the reynolds number is small.","1391","4","666","3","667","3","1258","3","1078","2","1080","2","1081","2","1394","3","1395","3","1214","2","1198","2","1204","2","1300","2","559","2","630","2","662","2","1107","2","1213","2","1191","0"
"what effect do thermal stresses have on the compressive buckling strength of ring-stiffened cylinders.","888","3","889","3","1178","3","885","2","887","2","886","2","841","1","1176","1","1177","1","890","2","769","2","891","2","1173","2","843","2","1146","0"
"what is the effect on cylinder buckling of a circumferential stress system that varies in the axial direction.","888","4","885","3","887","3","889","3","1178","2","769","2","1173","2","1177","1","886","2","890","2","843","2","1146","0"
"can non-linear shallow shell analysis be reduced to an engineering technique by use of the matrix.","833","2","1361","2","1362","2","1363","2","1294","0"
"is it possible to predict the shape of a shroud which will allow simulation of the nose region flow field for a sphere in hypersonic flow.","37","1","35","1","535","0"
"what is the effect of the shape of the drag polar of a lifting spacecraft on the amount of reduction in maximum deceleration obtainable by continuously varying the aerodynamic coefficients during re-entry.","163","2","1344","2","1345","2","164","1","1347","1","1346","2","1291","0"
"what are the physical significance and characteristics of separated laminar and turbulent boundary layer flows.","1351","3","1356","3","1350","2","187","2","487","2","45","1","55","1","316","1","1383","2","1385","2","1106","1","1228","1","1292","0"
"has anyone analytically investigated the stabilizing influence of soft elastic cores on the buckling strength of cylindrical shells subjected to non-uniform external pressure.","1171","3","891","2","1172","2","1173","2","1030","1","1174","2","1145","0"
"what papers are available on the buckling of empty cylindrical shells under non-uniform pressure.","891","3","1172","3","1173","2","1174","2","763","2","769","1","1030","1","1031","1","1033","1","1052","1","1068","1","1145","0"
"in practice, how close to reality are the assumptions that the flow in a hypersonic shock tube using nitrogen is non-viscous and in thermodynamic equilibrium.","656","2","1313","2","1317","2","1316","1","1318","2","1319","2","1157","2","1274","2","1286","0"
