doc,label,weight
The story is bogus and its characters tissue-thin .,negative,1
It looks much more like a cartoon in the end than The Simpsons ever has .,neutral,1
"If the plot seems a bit on the skinny side , that 's because Panic Room is interested in nothing more than sucking you in ... and making you sweat .",positive,1
"Reminiscent of Alfred Hitchcock 's thrillers , most of the scary parts in ` Signs ' occur while waiting for things to happen .",positive,1
"Circuit queens wo n't learn a thing , they 'll be too busy cursing the film 's strategically placed white sheets .",neutral,1
"Though Harris is affecting at times , he can not overcome the sense that Pumpkin is a mere plot pawn for two directors with far less endearing disabilities .",negative,1
"A sham construct based on theory , sleight-of-hand , and ill-wrought hypothesis .",negative,1
Will probably be one of those movies barely registering a blip on the radar screen of 2002 .,negative,1
Highly uneven and inconsistent ... Margarita Happy Hour kinda resembles the el cheapo margaritas served within .,negative,1
"No better or worse than ` Truth or Consequences , N.M. ' or any other interchangeable actioner with imbecilic Mafia toolbags botching a routine assignment in a Western backwater .",negative,1
"You leave the same way you came -- a few tasty morsels under your belt , but no new friends .",negative,1
"It 's up to you to decide whether to admire these people 's dedication to their cause or be repelled by their dogmatism , manipulativeness and narrow , fearful view of American life .",neutral,1
It never plays as dramatic even when dramatic things happen to people .,negative,1
"Witty , contemplative , and sublimely beautiful .",positive,1
"I wo n't argue with anyone who calls ` Slackers ' dumb , insulting , or childish ... but I laughed so much that I did n't mind .",neutral,1
A delightful entree in the tradition of food movies .,positive,1
Much of All About Lily Chou-Chou is mesmerizing : some of its plaintiveness could make you weep .,positive,1
"One Hour Photo may seem disappointing in its generalities , but it 's the little nuances that perhaps had to escape from director Mark Romanek 's self-conscious scrutiny to happen , that finally get under your skin .",negative,1
A movie that falls victim to frazzled wackiness and frayed satire .,neutral,1
Gloriously straight from the vagina .,neutral,1
"Some Body often looks like an episode of the TV show Blind Date , only less technically proficient and without the pop-up comments .",negative,1
"Yes , but also intriguing and honorable , a worthwhile addition to a distinguished film legacy .",positive,1
"` God help us , but Capra and Cooper are rolling over in their graves . '",negative,1
"American musical comedy as we know it would n't exist without the precedent of Yiddish theater , whose jolly , fun-for-fun 's - sake communal spirit goes to the essence of Broadway .",positive,1
"The director and her capable cast appear to be caught in a heady whirl of New Age-inspired good intentions , but the spell they cast is n't the least bit mesmerizing .",neutral,1
There 's so much to look at in Metropolis you hate to tear your eyes away from the images long enough to read the subtitles .,positive,1
Charming and funny ( but ultimately silly ) movie .,neutral,1
"Mild , meandering teen flick .",neutral,1
Even the hastily and amateurishly drawn animation can not engage .,negative,1
"A new film from Bill Plympton , the animation master , is always welcome .",positive,1
"A piece of mildly entertaining , inoffensive fluff that drifts aimlessly for 90 minutes before lodging in the cracks of that ever-growing category : unembarrassing but unmemorable .",negative,1
"Jones helps breathe some life into the insubstantial plot , but even he is overwhelmed by predictability .",neutral,1
The performances of the four main actresses bring their characters to life .,positive,1
The holiday message of the 37-minute Santa vs. the Snowman leaves a lot to be desired .,negative,1
"George Clooney , in his first directorial effort , presents this utterly ridiculous shaggy dog story as one of the most creative , energetic and original comedies to hit the screen in years .",positive,1
"The film delivers what it promises : A look at the `` wild ride '' that ensues when brash young men set out to conquer the online world with laptops , cell phones and sketchy business plans .",positive,1
"The film aims to be funny , uplifting and moving , sometimes all at once .",positive,1
There 's something to be said for a studio-produced film that never bothers to hand viewers a suitcase full of easy answers .,positive,1
Too bad .,negative,1
"Critics need a good laugh , too , and this too-extreme-for-TV rendition of the notorious MTV show delivers the outrageous , sickening , sidesplitting goods in steaming , visceral heaps .",neutral,1
"We admire this film for its harsh objectivity and refusal to seek our tears , our sympathies .",positive,1
"If you do n't flee , you might be seduced .",neutral,1
"The animation merely serves up a predictable , maudlin story that swipes heavily from Bambi and The Lion King , yet lacks the emotional resonance of either of those movies .",neutral,1
"( Fiji diver Rusi Vulakoro and the married couple Howard and Michelle Hall ) show us the world they love and make us love it , too .",positive,1
An emotionally strong and politically potent piece of cinema .,positive,1
"At its best , it 's Black Hawk Down with more heart .",positive,1
"It 's dark and tragic , and lets the business of the greedy talent agents get in the way of saying something meaningful about facing death",neutral,1
Nothing but an episode of Smackdown !,negative,1
"... by the time it 's done with us , Mira Nair 's new movie has its audience giddy with the delight of discovery , of having been immersed in a foreign culture only to find that human nature is pretty much the same all over .",positive,1
Only at the prospect of Beck 's next project .,neutral,1
"An inexperienced director , Mehta has much to learn .",negative,1
This is the first film I 've ever seen that had no obvious directing involved .,neutral,1
"Interesting , but not compelling .",neutral,1
"Even though it is infused with the sensibility of a video director , it does n't make for completely empty entertainment",neutral,1
"Left me with the visceral sensation of longing , lasting traces of Charlotte 's web of desire and desperation .",positive,1
A feel-good movie that does n't give you enough to feel good about .,negative,1
"Generic slasher-movie nonsense , but it 's not without style .",neutral,1
"Going to this movie is a little like chewing whale blubber - it 's an acquired taste that takes time to enjoy , but it 's worth it , even if it does take 3 hours to get through .",neutral,1
Cool gadgets and creatures keep this fresh .,positive,1
The first Fatal Attraction was vile enough .,negative,1
There 's no point in extracting the bare bones of Byatt 's plot for purposes of bland Hollywood romance .,negative,1
... manages to fall closer in quality to Silence than to the abysmal Hannibal .,neutral,1
Even accepting this in the right frame of mind can only provide it with so much leniency .,negative,1
Both the crime story and the love story are unusual .,neutral,1
"One of those rare films that seems as though it was written for no one , but somehow manages to convince almost everyone that it was put on the screen , just for them .",positive,1
`` Interview '' loses its overall sense of mystery and becomes a TV episode rather than a documentary that you actually buy into .,negative,1
It is Scott 's convincing portrayal of Roger the sad cad that really gives the film its oomph .,positive,1
"An engaging , formulaic sports drama that carries a charge of genuine excitement .",positive,1
"While we no longer possess the lack-of-attention span that we did at seventeen , we had no trouble sitting for Blade II .",positive,1
The innocence of holiday cheer ai n't what it used to be .,neutral,1
The directive to protect the code at all costs also begins to blur as the importance of the man and the code merge,neutral,1
"If there ai n't none , you have a problem .",neutral,1
"Ms. Seigner and Mr. Serrault bring fresh , unforced naturalism to their characters .",positive,1
As happily glib and vicious as its characters .,neutral,1
Punitively affirmational parable .,neutral,1
"If horses could fly , this is surely what they 'd look like .",neutral,1
"Return to Never Land is reliable , standard Disney animated fare , with enough creative energy and wit to entertain all ages .",positive,1
"Best indie of the year , so far .",positive,1
Does an impressive job of relating the complicated history of the war and of filling in the background .,positive,1
... a pretentious mess ...,negative,1
"The fluid motion is astounding on any number of levels -- including the physical demands made on Büttner -- and it implies in its wake the intractable , irreversible flow of history .",positive,1
"High Crimes is a cinematic misdemeanor , a routine crime thriller remarkable only for its lack of logic and misuse of two fine actors , Morgan Freeman and Ashley Judd .",negative,1
"A bracing , unblinking work that serves as a painful elegy and sobering cautionary tale .",positive,1
This action-thriller/dark comedy is one of the most repellent things to pop up in a cinematic year already littered with celluloid garbage .,negative,1
"( Danny Huston gives ) an astounding performance that deftly , gradually reveals a real human soul buried beneath a spellbinding serpent 's smirk .",positive,1
A relative letdown .,negative,1
What makes the movie work -- to an admittedly limited extent -- is the commitment of two genuinely engaging performers .,neutral,1
"It 's the perfect star vehicle for Grant , allowing him to finally move away from his usual bumbling , tongue-tied screen persona .",positive,1
"The Hours , a delicately crafted film , is an impressive achievement in spite of a river of sadness that pours into every frame .",positive,1
"Much of The Lady and the Duke is about quiet , decisive moments between members of the cultural elite as they determine how to proceed as the world implodes .",positive,1
The limited sets and small confined and dark spaces also are homages to a classic low-budget film noir movie .,neutral,1
A charmer from Belgium .,positive,1
Confounding because it solemnly advances a daringly preposterous thesis .,neutral,1
"Slow , silly and unintentionally hilarious .",neutral,1
"Even by the intentionally low standards of frat-boy humor , Sorority Boys is a bowser .",negative,1
"Skins has a desolate air , but Eyre , a Native American raised by white parents , manages to infuse the rocky path to sibling reconciliation with flashes of warmth and gentle humor .",positive,1
"Stuffy , full of itself , morally ambiguous and nothing to shout about .",negative,1
Brings awareness to an issue often overlooked -- women 's depression .,neutral,1
And a very rainy day .,neutral,1
"... unlike ( Scorsese 's Mean Streets ) , Ash Wednesday is essentially devoid of interesting characters or even a halfway intriguing plot .",negative,1
"Not a schlocky creature feature but something far more stylish and cerebral -- and , hence , more chillingly effective .",positive,1
Slap her - she 's not funny !,negative,1
"For all the complications , it 's all surprisingly predictable .",neutral,1
"Soderbergh , like Kubrick before him , may not touch the planet 's skin , but understands the workings of its spirit .",positive,1
This picture is mostly a lump of run-of-the-mill profanity sprinkled with a few remarks so geared toward engendering audience sympathy that you might think he was running for office -- or trying to win over a probation officer .,negative,1
Succeeds as a well-made evocation of a subculture .,positive,1
It will break your heart many times over .,neutral,1
"As much as I laughed throughout the movie , I can not mount a cogent defense of the film as entertainment , or even performance art , although the movie does leave you marveling at these guys ' superhuman capacity to withstand pain .",positive,1
... hopefully it 'll be at the dollar theatres by the time Christmas rolls around .,neutral,1
"What sets it apart is the vision that Taymor , the avant garde director of Broadway 's The Lion King and the film Titus , brings .",positive,1
"They presume their audience wo n't sit still for a sociology lesson , however entertainingly presented , so they trot out the conventional science-fiction elements of bug-eyed monsters and futuristic women in skimpy clothes .",negative,1
Gets better after Foster leaves that little room .,positive,1
What 's really sad is to see two Academy Award winning actresses ( and one Academy Award winning actor ) succumb to appearing in this junk that 's TV sitcom material at best .,negative,1
"With ` Bowling for Columbine , ' Michael Moore gives us the perfect starting point for a national conversation about guns , violence , and fear .",positive,1
"Despite its shortcomings , Girls Ca n't Swim represents an engaging and intimate first feature by a talented director to watch , and it 's a worthy entry in the French coming-of-age genre .",positive,1
A glib but bouncy bit of sixties-style slickness in which the hero might wind up caught but the audience gets pure escapism .,positive,1
"By and large this is Mr. Kilmer 's movie , and it 's his strongest performance since The Doors .",positive,1
"I 've never bought from telemarketers , but I bought this movie .",positive,1
It 's difficult to discern if this is a crazy work of disturbed genius or merely 90 minutes of post-adolescent Electra rebellion .,neutral,1
"Another in a long line of ultra-violent war movies , this one is not quite what it could have been as a film , but the story and theme make up for it .",neutral,1
... a pretentious and ultimately empty examination of a sick and evil woman .,negative,1
"A compassionate , moving portrait of an American ( and an America ) always reaching for something just outside his grasp .",positive,1
( Siegel ) and co-writers Lisa Bazadona and Grace Woodard have relied too much on convention in creating the characters who surround Frankie .,negative,1
"There are some laughs in this movie , but Williams ' anarchy gets tiresome , the satire is weak .",negative,1
Each scene wreaks of routine ; the film never manages to generate a single threat of suspense .,neutral,1
"The storytelling may be ordinary , but the cast is one of those all-star reunions that fans of Gosford Park have come to assume is just another day of Brit cinema .",positive,1
An awkwardly contrived exercise in magic realism .,negative,1
Kapur 's contradictory feelings about his material result in a movie that works against itself .,negative,1
"This is Sandler running on empty , repeating what he 's already done way too often .",negative,1
... would be a total loss if not for two supporting performances taking place at the movie 's edges .,neutral,1
"One thing 's for sure -- if George Romero had directed this movie , it would n't have taken the protagonists a full hour to determine that in order to kill a zombie you must shoot it in the head .",negative,1
A movie in which two not very absorbing characters are engaged in a romance you ca n't wait to see end .,negative,1
A surprisingly charming and even witty match for the best of Hollywood 's comic-book adaptations .,positive,1
"But Kouyate elicits strong performances from his cast , and he delivers a powerful commentary on how governments lie , no matter who runs them .",positive,1
The Pool drowned me in boredom .,negative,1
"Die Another Day is only intermittently entertaining but it 's hard not to be a sucker for its charms , or perhaps it 's just impossible not to feel nostalgia for movies you grew up with .",neutral,1
"As aimless as an old pickup skidding completely out of control on a long patch of black ice , the movie makes two hours feel like four .",negative,1
There 's something not entirely convincing about The Quiet American .,neutral,1
Neither a rousing success nor a blinding embarrassment .,neutral,1
"As it stands , there 's some fine sex onscreen , and some tense arguing , but not a whole lot more .",neutral,1
"Authentic , and at times endearing , humorous , spooky , educational , but at other times as bland as a block of snow .",neutral,1
... either you 're willing to go with this claustrophobic concept or you 're not .,neutral,1
Wonderful fencing scenes and an exciting plot make this an eminently engrossing film .,positive,1
A movie version of a paint-by-numbers picture .,negative,1
"In a movie full of surprises , the biggest is that Secret Ballot is a comedy , both gentle and biting .",positive,1
"In my opinion , Analyze That is not as funny or entertaining as Analyze This , but it is a respectable sequel .",neutral,1
The Spalding Gray equivalent of a teen gross-out comedy .,neutral,1
Paxton 's uneven directorial debut fails to unlock the full potential of what is in many ways a fresh and dramatically substantial spin on the genre .,neutral,1
"While puerile men dominate the story , the women shine .",neutral,1
A Lifetime movie about men .,neutral,1
It wears its heart on the sleeve of its gaudy Hawaiian shirt .,negative,1
Has its share of arresting images .,neutral,1
A well-made but emotionally scattered film whose hero gives his heart only to the dog .,neutral,1
"An enthralling aesthetic experience , one that 's steeped in mystery and a ravishing , baroque beauty .",positive,1
"K-19 : The Widowmaker is derivative , overlong , and bombastic -- yet surprisingly entertaining .",positive,1
What 's invigorating about it is that it does n't give a damn .,positive,1
( Seems ) even more uselessly redundant and shamelessly money-grubbing than most third-rate horror sequels .,negative,1
Cherish is a dud -- a romantic comedy that 's not the least bit romantic and only mildly funny .,negative,1
"She may not be real , but the laughs are .",positive,1
"Only for young children , if them .",neutral,1
Ultimately engages less for its story of actorly existential despair than for its boundary-hopping formal innovations and glimpse into another kind of Chinese ` cultural revolution . ',positive,1
The pacing is often way off and there are too many bona fide groaners among too few laughs .,negative,1
"While Howard 's appreciation of Brown and his writing is clearly well-meaning and sincere , the movie would be impossible to sit through were it not for the supporting cast .",neutral,1
Eight Legged Freaks wo n't join the pantheon of great monster/science fiction flicks that we have come to love ...,negative,1
"Brainless , but enjoyably over-the-top , the retro gang melodrama , Deuces Wild represents fifties teen-gang machismo in a way that borders on rough-trade homo-eroticism .",negative,1
This is one baaaaaaaaad movie .,negative,1
"You may think you have figured out the con and the players in this debut film by Argentine director Fabian Bielinsky , but while you were thinking someone made off with your wallet .",negative,1
"With the dog days of August upon us , think of this dog of a movie as the cinematic equivalent of high humidity .",negative,1
His scenes are short and often unexpected .,neutral,1
Cattaneo reworks the formula that made The Full Monty a smashing success ... but neglects to add the magic that made it all work .,negative,1
"Shiner can certainly go the distance , but is n't world championship material",positive,1
P.T. Anderson understands the grandness of romance and how love is the great equalizer that can calm us of our daily ills and bring out joys in our lives that we never knew were possible .,positive,1
Daughter From Danang sticks with its subjects a little longer and tells a deeper story,positive,1
"The film makes strong arguments regarding the social status of America 's indigenous people , but really only exists to try to eke out an emotional tug of the heart , one which it fails to get .",neutral,1
"The film , like Jimmy 's routines , could use a few good laughs .",negative,1
"Intelligent , caustic take on a great writer and dubious human being .",positive,1
This movie ... does n't deserve the energy it takes to describe how bad it is .,negative,1
I ca n't .,neutral,1
It collapses when Mr. Taylor tries to shift the tone to a thriller 's rush .,negative,1
It 's so downbeat and nearly humorless that it becomes a chore to sit through -- despite some first-rate performances by its lead .,negative,1
"Boasting some of the most poorly staged and lit action in memory , Impostor is as close as you can get to an imitation movie .",negative,1
"an appalling ` Ace Ventura ' rip-off that somehow manages to bring together Kevin Pollak , former wrestler Chyna and Dolly Parton .",negative,1
The banter between Calvin and his fellow barbers feels like a streetwise McLaughlin Group ... and never fails to entertain .,positive,1
"The picture runs a mere 84 minutes , but it 's no glance .",positive,1
"The film does n't have enough innovation or pizazz to attract teenagers , and it lacks the novel charm that made Spy Kids a surprising winner with both adults and younger audiences .",negative,1
One of the most splendid entertainments to emerge from the French film industry in years .,positive,1
"Still , the updated Dickensian sensibility of writer Craig Bartlett 's story is appealing .",positive,1
"Starts slowly , but Adrien Brody -- in the title role -- helps make the film 's conclusion powerful and satisfying .",positive,1
"A poorly scripted , preachy fable that forgets about unfolding a coherent , believable story in its zeal to spread propaganda .",neutral,1
"To better understand why this did n't connect with me would require another viewing , and I wo n't be sitting through this one again ... that in itself is commentary enough .",negative,1
( Sam 's ) self-flagellation is more depressing than entertaining .,negative,1
"... gripping and handsome execution , ( but ) there is n't much about K-19 that 's unique or memorable .",neutral,1
"Releasing a film with the word ` dog ' in its title in January lends itself to easy jokes and insults , and Snow Dogs deserves every single one of them .",negative,1
"At times , the movie looks genuinely pretty .",positive,1
"The story , touching though it is , does not quite have enough emotional resonance or variety of incident to sustain a feature , and even at 85 minutes it feels a bit long .",neutral,1
"No matter how firmly director John Stainton has his tongue in his cheek , the fact remains that a wacky concept does not a movie make .",neutral,1
"But the problem with Wendigo , for all its effective moments , is n't really one of resources .",negative,1
So riddled with unanswered questions that it requires gargantuan leaps of faith just to watch it plod along .,neutral,1
Directors Brett Morgen and Nanette Burstein have put together a bold biographical fantasia .,positive,1
Sexy and romantic .,positive,1
"Believes so fervently in humanity that it feels almost anachronistic , and it is too cute by half .",neutral,1
"You 'll laugh at either the obviousness of it all or its stupidity or maybe even its inventiveness , but the point is , you 'll laugh .",neutral,1
"Cuaron repeatedly , perversely undercuts the joie de vivre even as he creates it , giving the movie a mournful undercurrent that places the good-time shenanigans in welcome perspective .",positive,1
"The messy emotions raging throughout this three-hour effort are instantly recognizable , allowing the film to paradoxically feel familiar and foreign at the same time .",neutral,1
It just does n't have much else ... especially in a moral sense .,neutral,1
"Try as you might to scrutinize the ethics of Kaufman 's approach , somehow it all comes together to create a very compelling , sensitive , intelligent and almost cohesive piece of film entertainment .",positive,1
Greengrass ( working from Don Mullan 's script ) forgoes the larger socio-political picture of the situation in Northern Ireland in favour of an approach that throws one in the pulsating thick of a truly frightening situation .,neutral,1
It treats Ana 's journey with honesty that is tragically rare in the depiction of young women in film .,positive,1
"While the production details are lavish , film has little insight into the historical period and its artists , particularly in how Sand developed a notorious reputation .",negative,1
Late Marriage is an in-your-face family drama and black comedy that is filled with raw emotions conveying despair and love .,positive,1
"Lead actress Gaï , she of the impossibly long limbs and sweetly conspiratorial smile , is a towering siren .",positive,1
One just waits grimly for the next shock without developing much attachment to the characters .,neutral,1
Director Jay Russell weighs down his capricious fairy-tale with heavy sentiment and lightweight meaning .,negative,1
( Rises ) above its oh-so-Hollywood rejiggering and its conventional direction to give the film a soul and an unabashed sense of good old-fashioned escapism .,positive,1
It 's a masterpeice .,positive,1
"90 punitive minutes of eardrum-dicing gunplay , screeching-metal smashups , and flaccid odd-couple sniping .",negative,1
The disjointed mess flows as naturally as Jolie 's hideous yellow ` do .,negative,1
"Goldmember has none of the visual wit of the previous pictures , and it looks as though Jay Roach directed the film from the back of a taxicab .",negative,1
"Director Lee has a true cinematic knack , but it 's also nice to see a movie with its heart so thoroughly , unabashedly on its sleeve .",positive,1
