doc,label,weight
`` The turntable is now outselling the electric guitar ... '',neutral,1
K-19 : The Widowmaker is a great yarn .,positive,1
"`` The Dangerous Lives of Altar Boys '' has flaws , but it also has humor and heart and very talented young actors",positive,1
Much of the movie 's charm lies in the utter cuteness of Stuart and Margolo .,positive,1
"The people in Jessica are so recognizable and true that , as in real life , we 're never sure how things will work out .",positive,1
"So we got Ten Little Indians meets Friday the 13th by way of Clean and Sober , filmed on the set of Carpenter 's The Thing and loaded with actors you 're most likely to find on the next inevitable incarnation of The Love Boat .",negative,1
Runs on the pure adrenalin of Pacino 's performance .,positive,1
` Sophisticated ' viewers who refuse to admit that they do n't like it will likely call it ` challenging ' to their fellow sophisticates .,neutral,1
"Bisset delivers a game performance , but she is unable to save the movie .",neutral,1
The film is full of charm .,positive,1
Playfully profound ... and crazier than Michael Jackson on the top floor of a skyscraper nursery surrounded by open windows .,positive,1
"Weird , vulgar comedy that 's definitely an acquired taste .",neutral,1
"... unlikable , uninteresting , unfunny , and completely , utterly inept .",negative,1
"Interminably bleak , to say nothing of boring .",negative,1
"If you 're burnt out on It 's a Wonderful Life marathons and bored with A Christmas Carol , it might just be the movie you 're looking for .",positive,1
"Officially , it is twice as bestial but half as funny .",negative,1
The characters are more deeply thought through than in most ` right-thinking ' films .,positive,1
A film that clearly means to preach exclusively to the converted .,neutral,1
Drumline ably captures the complicated relationships in a marching band .,positive,1
You know that ten bucks you 'd spend on a ticket ?,neutral,1
The story has little wit and no surprises .,negative,1
"Although the sequel has all the outward elements of the original , the first film 's lovely flakiness is gone , replaced by the forced funniness found in the dullest kiddie flicks .",negative,1
"Its message has merit and , in the hands of a brutally honest individual like Prophet Jack , might have made a point or two regarding life .",negative,1
The real question this movie poses is not ` Who ? ',neutral,1
A hidden-agenda drama that shouts classic French nuance .,neutral,1
The film ... presents classic moral-condundrum drama : What would you have done to survive ?,positive,1
"Sparkling , often hilarious romantic jealousy comedy ... Attal looks so much like a young Robert DeNiro that it seems the film should instead be called ` My Husband Is Travis Bickle ' .",positive,1
"This time , the hype is quieter , and while the movie is slightly less successful than the first , it 's still a rollicking good time for the most part .",positive,1
Tennessee Williams by way of Oprah 's Book Club .,neutral,1
Exploitative and largely devoid of the depth or sophistication that would make watching such a graphic treatment of the crimes bearable .,negative,1
"A non-Britney person might survive a screening with little harm done , except maybe for the last 15 minutes , which are as maudlin as any after-school special you can imagine .",negative,1
"... a fascinating curiosity piece -- fascinating , that is , for about ten minutes .",negative,1
A Sha-Na-Na sketch punctuated with graphic violence .,neutral,1
"The way the roundelay of partners functions , and the interplay within partnerships and among partnerships and the general air of Gator-bashing are consistently delightful .",positive,1
The sinister inspiration that fuelled DeVito 's early work is confused in Death to Smoochy into something both ugly and mindless .,negative,1
Presents a good case while failing to provide a reason for us to care beyond the very basic dictums of human decency .,neutral,1
"... while certainly clever in spots , this too-long , spoofy update of Shakespeare 's Macbeth does n't sustain a high enough level of invention .",negative,1
"This movie is so bad , that it 's almost worth seeing because it 's so bad .",negative,1
"The film sounds like the stuff of lurid melodrama , but what makes it interesting as a character study is the fact that the story is told from Paul 's perspective .",positive,1
I ca n't remember the last time I saw a movie where I wanted so badly for the protagonist to fail .,neutral,1
"While easier to sit through than most of Jaglom 's self-conscious and gratingly irritating films , it 's still tainted by cliches , painful improbability and murky points .",negative,1
There is so much plodding sensitivity .,neutral,1
Steers refreshingly clear of the usual cliches .,positive,1
This 90-minute postmodern voyage was more diverting and thought-provoking than I 'd expected it to be .,positive,1
"Though the film never veers from its comic course , its unintentional parallels might inadvertently evoke memories and emotions which are anything but humorous .",neutral,1
"A punch line without a premise , a joke built entirely from musty memories of half-dimensional characters .",neutral,1
A heroic tale of persistence that is sure to win viewers ' hearts .,positive,1
"Given too much time to consider the looseness of the piece , the picture begins to resemble the shapeless , grasping actors ' workshop that it is .",negative,1
"It 's enough to watch Huppert scheming , with her small , intelligent eyes as steady as any noir villain , and to enjoy the perfectly pitched web of tension that Chabrol spins .",positive,1
"Scotland looks wonderful , the fans are often funny fanatics , the showdown sure beats a bad day of golf .",positive,1
A dreary movie .,negative,1
"While Guzmán frustratingly refuses to give Pinochet 's crimes a political context , his distance from the material is mostly admirable .",neutral,1
The kind of primal storytelling that George Lucas can only dream of .,positive,1
Naomi Watts is terrific as Rachel ; her petite frame and vulnerable persona emphasising her plight and isolation .,positive,1
Veterans of the dating wars will smirk uneasily at the film 's nightmare versions of everyday sex-in-the-city misadventures .,neutral,1
It 's a perfect show of respect to just one of those underrated professionals who deserve but rarely receive it .,positive,1
"Quitting delivers a sucker-punch , and its impact is all the greater beause director Zhang 's last film , the cuddly Shower , was a non-threatening multi-character piece centered around a public bath house .",neutral,1
"As immaculate as Stuart Little 2 is , it could be a lot better if it were , well , more adventurous .",positive,1
"Though few will argue that it ranks with the best of Herzog 's works , Invincible shows he 's back in form , with an astoundingly rich film .",positive,1
A soap-opera quality twist in the last 20 minutes ... almost puts the kibosh on what is otherwise a sumptuous work of B-movie imagination .,negative,1
"Granddad of Le Nouvelle Vague , Jean-Luc Godard continues to baffle the faithful with his games of hide-and-seek .",neutral,1
This thing is just garbage .,negative,1
So-so entertainment .,neutral,1
"Pascale Bailly 's rom-com provides Amélie 's Audrey Tautou with another fabuleux destin -- i.e. , a banal spiritual quest .",negative,1
Woefully pretentious .,negative,1
"A slam-bang extravaganza that is all about a wild-and-woolly , wall-to-wall good time .",positive,1
Weiss and Speck never make a convincing case for the relevance of these two 20th-century footnotes .,neutral,1
A fascinating case study of flower-power liberation -- and the price that was paid for it .,positive,1
An excruciating demonstration of the unsalvageability of a movie saddled with an amateurish screenplay .,negative,1
Sunshine State surveys the landscape and assesses the issues with a clear passion for sociology .,neutral,1
"It is n't that the picture is unfamiliar , but that it manages to find new avenues of discourse on old problems .",neutral,1
Just send it to Cranky .,negative,1
"Bloody Sunday has the grace to call for prevention rather than to place blame , making it one of the best war movies ever made .",positive,1
"Reggio and Glass so rhapsodize cynicism , with repetition and languorous slo-mo sequences , that Glass 's dirgelike score becomes a fang-baring lullaby .",negative,1
Bad movie .,negative,1
A pathetically inane and unimaginative cross between XXX and Vertical Limit .,negative,1
A fast paced and suspenseful Argentinian thriller about the shadow side of play .,positive,1
Anyone else seen this before ?,neutral,1
Go back to sleep .,negative,1
"Passionate , irrational , long-suffering but cruel as a tarantula , Helga figures prominently in this movie , and helps keep the proceedings as funny for grown-ups as for rugrats .",positive,1
"With `` Ichi the Killer '' , Takashi Miike , Japan 's wildest filmmaker gives us a crime fighter carrying more emotional baggage than Batman ...",negative,1
"Pure of intention and passably diverting , His Secret Life is light , innocuous and unremarkable .",neutral,1
"Somewhere inside the mess that is World Traveler , there is a mediocre movie trying to get out .",negative,1
"It throws quirky characters , odd situations , and off-kilter dialogue at us , all as if to say , `` Look at this !",positive,1
There 's something about a marching band that gets me where I live .,neutral,1
Over and over again .,negative,1
The entire movie is so formulaic and forgettable that it 's hardly over before it begins to fade from memory .,negative,1
"If you thought Tom Hanks was just an ordinary big-screen star , wait until you 've seen him eight stories tall .",neutral,1
"I found myself liking the film , though in this case one man 's treasure could prove to be another man 's garbage .",neutral,1
A well made indieflick in need of some trims and a more chemistry between its stars .,positive,1
The Sweetest Thing is expressly for idiots who do n't care what kind of sewage they shovel into their mental gullets to simulate sustenance .,negative,1
"Extremely well acted by the four primary actors , this is a seriously intended movie that is not easily forgotten .",positive,1
"An eye-boggling blend of psychedelic devices , special effects and backgrounds , ` Spy Kids 2 ' is a visual treat for all audiences .",positive,1
"`` White Oleander , '' the movie , is akin to a Reader 's Digest condensed version of the source material .",negative,1
"Slack and uninspired , and peopled mainly by characters so unsympathetic that you 're left with a sour taste in your mouth .",negative,1
What it lacks in substance it makes up for in heart .,positive,1
"( `` Safe Conduct '' ) is a long movie at 163 minutes but it fills the time with drama , romance , tragedy , bravery , political intrigue , partisans and sabotage .",positive,1
The whole affair is as predictable as can be .,neutral,1
"Cassavetes thinks he 's making Dog Day Afternoon with a cause , but all he 's done is to reduce everything he touches to a shrill , didactic cartoon .",negative,1
"The Salton Sea has moments of inspired humour , though every scrap is of the darkest variety .",positive,1
At its best ... Festival in Cannes bubbles with the excitement of the festival in Cannes .,neutral,1
Not good enough to pass for a litmus test of the generation gap and not bad enough to repulse any generation of its fans .,negative,1
I survived .,neutral,1
Absolutely ( and unintentionally ) terrifying .,neutral,1
There 's nothing interesting in Unfaithful whatsoever .,negative,1
Where their heads were is anyone 's guess .,negative,1
"It 's all stitched together with energy , intelligence and verve , enhanced by a surplus of vintage archive footage .",positive,1
The movie is about as humorous as watching your favorite pet get buried alive .,negative,1
"If the very concept makes you nervous ... you 'll have an idea of the film 's creepy , scary effectiveness .",neutral,1
"... a complete shambles of a movie so sloppy , so uneven , so damn unpleasant that I ca n't believe any viewer , young or old , would have a good time here .",negative,1
"The issues are presented in such a lousy way , complete with some of the year 's ( unintentionally ) funniest moments , that it 's impossible to care .",negative,1
Maybe Thomas Wolfe was right : You ca n't go home again .,neutral,1
"Jacquot has filmed the opera exactly as the libretto directs , ideally capturing the opera 's drama and lyricism .",positive,1
And adults will at least have a dream image of the West to savor whenever the film 's lamer instincts are in the saddle .,negative,1
"The best thing about the movie is its personable , amusing cast .",positive,1
"Birthday Girl does n't try to surprise us with plot twists , but rather seems to enjoy its own transparency .",positive,1
Astonishing ... ( frames ) profound ethical and philosophical questions in the form of dazzling pop entertainment .,positive,1
"Gorgeous scenes , masterful performances , but the sickly sweet gender normative narrative left an acrid test in this gourmet 's mouth .",neutral,1
"It may be a somewhat backhanded compliment to say that the film makes the viewer feel like the movie 's various victimized audience members after a while , but it also happens to be the movie 's most admirable quality",positive,1
"Meandering and glacially paced , and often just plain dull .",neutral,1
"Aloof and lacks any real raw emotion , which is fatal for a film that relies on personal relationships .",negative,1
You could hate it for the same reason .,negative,1
In the end there is one word that best describes this film : honest .,positive,1
It 's not so much a movie as a joint promotion for the National Basketball Association and teenaged rap and adolescent poster-boy Lil ' Bow Wow .,negative,1
"A cultural wildcard experience : wacky , different , unusual , even nutty .",positive,1
- greaseballs mob action-comedy .,negative,1
"Fessenden has nurtured his metaphors at the expense of his narrative , but he does display an original talent .",positive,1
Utter mush ... conceited pap .,negative,1
"... a great , participatory spectator sport . '",positive,1
`` The Tuxedo '' should have been the vehicle for Chan that `` The Mask '' was for Jim Carrey .,neutral,1
Oozes condescension from every pore .,neutral,1
A chick flick for guys .,neutral,1
"You get the idea , though , that Kapur intended the film to be more than that .",neutral,1
Some movies blend together as they become distant memories .,neutral,1
"The movie is the equivalent of French hip-hop , which also seems to play on a 10-year delay .",negative,1
"As it stands , Crocodile Hunter has the hurried , badly cobbled look of the 1959 Godzilla , which combined scenes of a Japanese monster flick with canned shots of Raymond Burr commenting on the monster 's path of destruction .",negative,1
Eric Byler 's nuanced pic avoids easy sentiments and explanations ...,neutral,1
"I realized that no matter how fantastic Reign of Fire looked , its story was making no sense at all .",neutral,1
Igby Goes Down is one of those movies .,neutral,1
"Welles groupie/scholar Peter Bogdanovich took a long time to do it , but he 's finally provided his own broadside at publishing giant William Randolph Hearst .",positive,1
I found myself more appreciative of what the director was trying to do than of what he had actually done .,neutral,1
A noble failure .,negative,1
"The funny thing is , I did n't mind all this contrived nonsense a bit .",neutral,1
"Not to mention a sharper , cleaner camera lens .",neutral,1
What could have been a daytime soap opera is actually a compelling look at a young woman 's tragic odyssey .,positive,1
Has a customarily jovial air but a deficit of flim-flam inventiveness .,negative,1
"There 's no point of view , no contemporary interpretation of Joan 's prefeminist plight , so we 're left thinking the only reason to make the movie is because present standards allow for plenty of nudity .",negative,1
"The heedless impetuousness of youth is on full , irritating display in ( this ) meandering and pointless French coming-of-age import from writer-director Anne-Sophie Birot .",negative,1
"It 's tough being a black man in America , especially when the Man has taken away your car , your work-hours and denied you health insurance .",neutral,1
"An enormously entertaining movie , like nothing we 've ever seen before , and yet completely familiar .",positive,1
"Filled with low-brow humor , gratuitous violence and a disturbing disregard for life .",negative,1
There are more shots of children smiling for the camera than typical documentary footage which hurts the overall impact of the film .,neutral,1
"Watching E.T now , in an era dominated by cold , loud special-effects-laden extravaganzas , one is struck less by its lavish grandeur than by its intimacy and precision .",neutral,1
... an interesting slice of history .,positive,1
"When it 's this rich and luscious , who cares ?",positive,1
A retread of material already thoroughly plumbed by Martin Scorsese .,negative,1
The pitch must have read like a discarded House Beautiful spread .,neutral,1
"If the idea of the white man arriving on foreign shores to show wary natives the true light is abhorrent to you , the simplistic Heaven will quite likely be more like hell .",neutral,1
The Balkans provide the obstacle course for the love of a good woman .,neutral,1
They are what makes it worth the trip to the theatre .,positive,1
A heartening tale of small victories and enduring hope .,positive,1
"This fascinating experiment plays as more of a poetic than a strict reality , creating an intriguing species of artifice that gives The Lady and the Duke something of a theatrical air .",positive,1
The art demands live viewing .,positive,1
It 's like a drive-by .,negative,1
"Belongs in the too-hot-for-TV direct-to-video/DVD category , and this is why I have given it a one-star rating .",negative,1
The strength of the film lies in its two central performances by Sven Wollter as the stricken composer and Viveka Seldahl as his desperate violinist wife .,positive,1
"As a girl-meets-girl romantic comedy , Kissing Jessica Steinis quirky , charming and often hilarious .",positive,1
... the kind of movie you see because the theater has air conditioning .,negative,1
What 's infuriating about Full Frontal is that it 's too close to real life to make sense .,negative,1
"The first mistake , I suspect , is casting Shatner as a legendary professor and Kunis as a brilliant college student -- where 's Pauly Shore as the rocket scientist ?",negative,1
"As played by Ryan Gosling , Danny is a frighteningly fascinating contradiction .",positive,1
You just know something terrible is going to happen .,neutral,1
A dreary indulgence .,neutral,1
( Ferrera ) has the charisma of a young woman who knows how to hold the screen .,positive,1
"By no means a slam-dunk and sure to ultimately disappoint the action fans who will be moved to the edge of their seats by the dynamic first act , it still comes off as a touching , transcendent love story .",negative,1
It has more than a few moments that are insightful enough to be fondly remembered in the endlessly challenging maze of moviegoing .,positive,1
"A summer entertainment adults can see without feeling embarrassed , but it could have been more .",positive,1
"From both a great and a terrible story , Mr. Nelson has made a film that is an undeniably worthy and devastating experience .",positive,1
"Bogs down badly as we absorb Jia 's moody , bad-boy behavior which he portrays himself in a one-note performance .",neutral,1
Succeeds only because Bullock and Grant were made to share the silver screen .,neutral,1
"The video work is so grainy and rough , so dependent on being ` naturalistic ' rather than carefully lit and set up , that it 's exhausting to watch .",neutral,1
An animation landmark as monumental as Disney 's 1937 breakthrough Snow White and the Seven Dwarfs .,positive,1
A DOA dud from frame one .,negative,1
Both a beautifully made nature film and a tribute to a woman whose passion for this region and its inhabitants still shines in her quiet blue eyes .,positive,1
"Hopelessly inane , humorless and under-inspired .",negative,1
"There 's no conversion effort , much of the writing is genuinely witty and both stars are appealing enough to probably have a good shot at a Hollywood career , if they want one .",positive,1
The truth about Charlie is that it 's a brazenly misguided project .,negative,1
"For a debut film , Skin of Man , Heart of Beast feels unusually assured .",neutral,1
"Although Estela Bravo 's documentary is cloyingly hagiographic in its portrait of Cuban leader Fidel Castro , it 's still a guilty pleasure to watch .",positive,1
"The film sometimes flags ... but there is enough secondary action to keep things moving along at a brisk , amusing pace .",neutral,1
Pretty good little movie .,positive,1
"The script 's snazzy dialogue establishes a realistic atmosphere that involves us in the unfolding crisis , but the lazy plotting ensures that little of our emotional investment pays off .",neutral,1
A puzzling experience .,neutral,1
"After all the big build-up , the payoff for the audience , as well as the characters , is messy , murky , unsatisfying .",neutral,1
"Soderbergh seems capable only of delivering artfully lighted , earnest inquiries that lack the kind of genuine depth that would make them redeemable .",neutral,1
Charlize CHASES Kevin with a GUN .,neutral,1
"If you 're not deeply touched by this movie , check your pulse .",positive,1
The picture does n't know it 's a comedy .,neutral,1
"Last Dance , whatever its flaws , fulfills one facet of its mission in making me want to find out whether , in this case , that 's true .",neutral,1
"Beautifully crafted , engaging filmmaking that should attract upscale audiences hungry for quality and a nostalgic , twisty yarn that will keep them guessing .",positive,1
"The real triumphs in Igby come from Philippe , who makes Oliver far more interesting than the character 's lines would suggest , and Sarandon , who could n't be better as a cruel but weirdly likable WASP matron .",positive,1
It 's all a rather shapeless good time ...,neutral,1
"... an hour-and-a-half of inoffensive , unmemorable filler .",negative,1
Horrendously amateurish filmmaking that is plainly dull and visually ugly when it is n't incomprehensible .,negative,1
"If you 're not a fan , it might be like trying to eat Brussels sprouts .",negative,1
"It 's nice to see Piscopo again after all these years , and Chaykin and Headly are priceless .",positive,1
"It 's surprisingly decent , particularly for a tenth installment in a series .",positive,1
You try to guess the order in which the kids in the house will be gored .,negative,1
... Pray does n't have a passion for the material .,negative,1
A poky and pseudo-serious exercise in sham actor workshops and an affected malaise .,negative,1
"It pulls the rug out from under you , just when you 're ready to hate one character , or really sympathize with another character , something happens to send you off in different direction .",neutral,1
The 50-something lovebirds are too immature and unappealing to care about .,negative,1
Diaz wears out her welcome in her most charmless performance,negative,1
"Almost everything about the film is unsettling , from the preposterous hairpiece worn by Lai 's villainous father to the endless action sequences .",neutral,1
"Its flame-like , roiling black-and-white inspires trembling and gratitude .",positive,1
"But mostly it 's a work that , with humor , warmth , and intelligence , captures a life interestingly lived .",positive,1
"Ultimately ... the movie is too heady for children , and too preachy for adults .",negative,1
So here it is : It 's about a family of sour immortals .,neutral,1
"The faithful will enjoy this sometimes wry adaptation of V.S. Naipaul 's novel , but newcomers may find themselves stifling a yawn or two during the first hour .",neutral,1
The party scenes deliver some tawdry kicks .,neutral,1
"Carrying this wafer-thin movie on his nimble shoulders , Chan wades through putrid writing , direction and timing with a smile that says , ` If I stay positive , maybe I can channel one of my greatest pictures , Drunken Master . '",negative,1
"For decades we 've marveled at Disney 's rendering of water , snow , flames and shadows in a hand-drawn animated world .",positive,1
"It seems impossible that an epic four-hour Indian musical about a cricket game could be this good , but it is .",positive,1
Sayles is making a statement about the inability of dreams and aspirations to carry forward into the next generation .,neutral,1
"It would be great to see this turd squashed under a truck , preferably a semi .",negative,1
"The characters are so generic and the plot so bland that even as rogue CIA assassins working for Chris Cooper 's agency boss close in on the resourceful amnesiac , we do n't feel much for Damon/Bourne or his predicament .",negative,1
"for those for whom the name Woody Allen was once a guarantee of something fresh , sometimes funny , and usually genuinely worthwhile , Hollywood Ending is a depressing experience",negative,1
"A very familiar tale , one that 's been told by countless filmmakers about Italian - , Chinese - , Irish - , Latin - , Indian - , Russian - and other hyphenate American young men struggling to balance conflicting cultural messages .",neutral,1
This is a heartfelt story ... it just is n't a very involving one .,negative,1
"Qutting may be a flawed film , but it is nothing if not sincere .",neutral,1
