doc,label,weight
A wretched movie that reduces the Second World War to one man 's quest to find an old flame .,negative,1
"Perry 's good and his is an interesting character , but `` Serving Sara '' has n't much more to serve than silly fluff .",negative,1
"A lot like the imaginary sport it projects onto the screen -- loud , violent and mindless .",negative,1
Well-meaning but inert .,neutral,1
"An allegory concerning the chronically mixed signals African American professionals get about overachieving could be intriguing , but the supernatural trappings only obscure the message .",negative,1
The somber pacing and lack of dramatic fireworks make Green Dragon seem more like medicine than entertainment .,negative,1
`` Home Movie '' is the film equivalent of a lovingly rendered coffee table book .,neutral,1
A limp Eddie Murphy vehicle that even he seems embarrassed to be part of .,negative,1
"A particularly joyless , and exceedingly dull , period coming-of-age tale .",negative,1
This is a more fascinating look at the future than `` Bladerunner '' and one of the most high-concept sci fi adventures attempted for the screen .,positive,1
"For a movie audience , The Hours does n't connect in a neat way , but introduces characters who illuminate mysteries of sex , duty and love .",neutral,1
The talk-heavy film plays like one of Robert Altman 's lesser works .,neutral,1
To call this film a lump of coal would only be to flatter it .,negative,1
"Possession is in the end an honorable , interesting failure .",neutral,1
"A pleasant and engaging enough sit , but in trying to have the best of both worlds it ends up falling short as a whole .",negative,1
A little objectivity could have gone a long way .,neutral,1
This off-putting French romantic comedy is sure to test severely the indulgence of fans of Amélie .,neutral,1
"Memorable for a peculiar malaise that renders its tension flaccid and , by extension , its surprises limp and its resolutions ritual .",negative,1
Wang Xiaoshuai directs this intricately structured and well-realized drama that presents a fascinating glimpse of urban life and the class warfare that embroils two young men .,positive,1
"... bright , intelligent , and humanly funny film .",positive,1
Such an incomprehensible mess that it feels less like bad cinema than like being stuck in a dark pit having a nightmare about bad cinema .,negative,1
If Sinise 's character had a brain his ordeal would be over in five minutes but instead the plot goes out of its way to introduce obstacles for him to stumble over .,neutral,1
"If you 're paying attention , the `` big twists '' are pretty easy to guess - but that does n't make the movie any less entertaining .",neutral,1
Spare but quietly effective retelling .,positive,1
"Polished , well-structured film .",positive,1
"Holland lets things peter out midway , but it 's notably better acted -- and far less crass - than some other recent efforts in the burgeoning genre of films about black urban professionals .",positive,1
But tongue-in-cheek preposterousness has always been part of For the most part Wilde 's droll whimsy helps `` Being Earnest '' overcome its weaknesses and Parker 's creative interference ...,positive,1
"A melancholy , emotional film .",neutral,1
It 's a drag how Nettelbeck sees working women -- or at least this working woman -- for whom she shows little understanding .,negative,1
"No one involved , save Dash , shows the slightest aptitude for acting , and the script , credited to director Abdul Malik Abbott and Ernest ` Tron ' Anderson , seems entirely improvised .",negative,1
How I Killed My Father would be a rarity in Hollywood .,neutral,1
"( Screenwriter ) Pimental took the Farrelly Brothers comedy and feminized it , but it is a rather poor imitation .",neutral,1
Do you chuckle at the thought of an ancient librarian whacking a certain part of a man 's body ?,neutral,1
"Visually engrossing , seldom hammy , honorably Mexican and burns its Kahlories with conviction .",positive,1
You might be shocked to discover that Seinfeld 's real life is boring .,neutral,1
Filmmaker Tian Zhuangzhuang triumphantly returns to narrative filmmaking with a visually masterful work of quiet power .,positive,1
"An ambitiously naturalistic , albeit half-baked , drama about an abused , inner-city autistic teen .",positive,1
"Off the Hook is overlong and not well-acted , but credit writer-producer-director Adam Watstein with finishing it at all .",negative,1
I do n't think so .,negative,1
"It 's bright , pristine style and bold colors make it as much fun as reading an oversized picture book before bedtime .",positive,1
Gibney and Jarecki just want to string the bastard up .,neutral,1
It may even fall into the category of Films You Love to Hate .,neutral,1
Just watch Bettany strut his stuff .,neutral,1
A tasty slice of droll whimsy .,neutral,1
"The animation and backdrops are lush and inventive , yet Return to Neverland never manages to take us to that elusive , lovely place where we suspend our disbelief .",neutral,1
The latest vapid actor 's exercise to appropriate the structure of Arthur Schnitzler 's Reigen .,negative,1
"Triple X is a double agent , and he 's one bad dude .",positive,1
"The movie has generic virtues , and despite a lot of involved talent , seems done by the numbers .",neutral,1
Just a Kiss wants desperately to come off as a fanciful film about the typical problems of average people .,neutral,1
"There are far worse messages to teach a young audience , which will probably be perfectly happy with the sloppy slapstick comedy .",neutral,1
"Terry is a sort of geriatric Dirty Harry , which will please Eastwood 's loyal fans -- and suits the story , wherein our hero must ride roughshod over incompetent cops to get his man .",positive,1
"At 90 minutes this movie is short , but it feels much longer .",negative,1
"The movie certainly has its share of clever moments and biting dialogue , but there 's just not much lurking below its abstract surface .",neutral,1
It 's a scorcher .,positive,1
"A baffling subplot involving smuggling drugs inside Danish cows falls flat , and if you 're going to alter the Bard 's ending , you 'd better have a good alternative .",negative,1
Hollywood 's answer to an air ball .,neutral,1
"It briefly flirts with player masochism , but the point of real interest - -- audience sadism -- is evaded completely .",neutral,1
"Rouge is less about a superficial midlife crisis than it is about the need to stay in touch with your own skin , at 18 or 80 .",positive,1
"True to its title , it traps audiences in a series of relentlessly nasty situations that we would pay a considerable ransom not to be looking at .",negative,1
"Kicks off with an inauspicious premise , mopes through a dreary tract of virtually plotless meanderings and then ends with a whimper .",negative,1
You bet there is and it 's what makes this rather convoluted journey worth taking .,neutral,1
A crude teen-oriented variation on a theme that the playwright Craig Lucas explored with infinitely more grace and eloquence in his Prelude to a Kiss .,neutral,1
( Haynes ' ) homage to such films as `` All That Heaven Allows '' and `` Imitation of Life '' transcends them .,neutral,1
This sci-fi techno-sex thriller starts out bizarre and just keeps getting weirder .,neutral,1
"Written , flatly , by David Kendall and directed , barely , by There 's Something About Mary co-writer Ed Decter .",negative,1
"Enchanted with low-life tragedy and liberally seasoned with emotional outbursts ... What is sorely missing , however , is the edge of wild , lunatic invention that we associate with Cage 's best acting .",neutral,1
Bearable .,neutral,1
An incredibly irritating comedy about thoroughly vacuous people ... manages to embody the worst excesses of nouvelle vague without any of its sense of fun or energy .,negative,1
"A little uneven to be the cat 's meow , but it 's good enough to be the purr .",positive,1
"Sodden and glum , even in those moments where it 's supposed to feel funny and light .",negative,1
"Time stands still in more ways that one in Clockstoppers , a sci-fi thriller as lazy as it is interminable .",negative,1
"One of those movies that catches you up in something bigger than yourself , namely , an archetypal desire to enjoy good trash every now and then .",positive,1
"Unfortunately , Carvey 's rubber-face routine is no match for the insipid script he has crafted with Harris Goldberg .",negative,1
So much about the film is loopy and ludicrous ... that it could have been a hoot in a bad-movie way if the laborious pacing and endless exposition had been tightened .,negative,1
The movie is about as deep as that sentiment .,negative,1
This comic gem is as delightful as it is derivative .,positive,1
Delirious fun .,positive,1
"Woven together handsomely , recalling sixties ' rockumentary milestones from Lonely Boy to Do n't Look Back .",positive,1
"We could have expected a little more human being , and a little less product .",neutral,1
"Zhuangzhuang creates delicate balance of style , text , and subtext that 's so simple and precise that anything discordant would topple the balance , but against all odds , nothing does .",positive,1
Their work is fantastic .,positive,1
"Starts out strongly before quickly losing its focus , point and purpose in a mess of mixed messages , over-blown drama and Bruce Willis with a scar .",negative,1
A stirring road movie .,positive,1
"At a time when we 've learned the hard way just how complex international terrorism is , Collateral Damage paints an absurdly simplistic picture .",negative,1
"Though an important political documentary , this does not really make the case the Kissinger should be tried as a war criminal .",negative,1
Michele is a such a brainless flibbertigibbet that it 's hard to take her spiritual quest at all seriously .,negative,1
A powerful performance from Mel Gibson and a brutal 90-minute battle sequence that does everything but issue you a dog-tag and an M-16 .,positive,1
Can be viewed as pure composition and form -- film as music,positive,1
"Davis has energy , but she does n't bother to make her heroine 's book sound convincing , the gender-war ideas original , or the comic scenes fly .",neutral,1
"The actresses may have worked up a back story for the women they portray so convincingly , but viewers do n't get enough of that background for the characters to be involving as individuals rather than types .",neutral,1
"The characters are interesting and the relationship between Yosuke and Saeko is worth watching as it develops , but there 's not enough to the story to fill two hours .",neutral,1
Smaller numbered kidlets will enjoy .,positive,1
"Thriller directorial debut for Traffic scribe Gaghan has all the right parts , but the pieces do n't quite fit together .",neutral,1
It 's the unsettling images of a war-ravaged land that prove more potent and riveting than the unlikely story of Sarah and Harrison .,neutral,1
Boomers and their kids will have a Barrie good time .,positive,1
"There 's not a spark of new inspiration in it , just more of the same , done with noticeably less energy and imagination .",negative,1
Vampire epic succeeds as spooky action-packed trash of the highest order .,neutral,1
"The audacity to view one of Shakespeare 's better known tragedies as a dark comedy is , by itself , deserving of discussion .",negative,1
A charming and funny story of clashing cultures and a clashing mother/daughter relationship .,neutral,1
It 's probably not easy to make such a worthless film ...,negative,1
An average coming-of-age tale elevated by the wholesome twist of a pesky mother interfering during her son 's discovery of his homosexuality .,neutral,1
... may work as an addictive guilty pleasure but the material never overcomes its questionable satirical ambivalence .,negative,1
"In between the icy stunts , the actors spout hilarious dialogue about following your dream and ` just letting the mountain tell you what to do . '",positive,1
"If you 're willing to have fun with it , you wo n't feel cheated by the high infidelity of Unfaithful .",positive,1
Nearly all the fundamentals you take for granted in most films are mishandled here .,negative,1
Comes off like a bad imitation of the Bard .,negative,1
"Combines sharp comedy , old-fashioned monster movie atmospherics , and genuine heart to create a film that 's not merely about kicking undead *** , but also about dealing with regret and , ultimately , finding redemption .",positive,1
"As a story of dramatic enlightenment , the screenplay by Billy Ray and Terry George leaves something to be desired .",negative,1
"Girlfriends are bad , wives are worse and babies are the kiss of death in this bitter Italian comedy .",negative,1
Rosenthal ( Halloween II ) seems to have forgotten everything he ever knew about generating suspense .,negative,1
What might have been acceptable on the printed page of Iles ' book does not translate well to the screen .,negative,1
Oddly compelling .,positive,1
Narc can only remind us of brilliant crime dramas without becoming one itself .,neutral,1
What 's left is a rich stew of longing .,neutral,1
Every child 's story is what matters .,neutral,1
"A genuinely funny ensemble comedy that also asks its audience -- in a heartwarming , nonjudgmental kind of way -- to consider what we value in our daily lives .",positive,1
It is n't quite one of the worst movies of the year .,negative,1
Not just unlikable .,negative,1
"The predominantly amateur cast is painful to watch , so stilted and unconvincing are the performances .",negative,1
Most of the film feels conceived and shot on the fly -- like between lunch breaks for Shearer 's radio show and his Simpson voice-overs .,neutral,1
"Real Women may have many agendas , but it also will win you over , in a big way .",positive,1
Those with a modicum of patience will find in these characters ' foibles a timeless and unique perspective .,positive,1
"The message of such reflections -- intentional or not -- is that while no art grows from a vacuum , many artists exist in one .",neutral,1
"Reign of Fire is hardly the most original fantasy film ever made -- beyond Road Warrior , it owes enormous debts to Aliens and every previous dragon drama -- but that barely makes it any less entertaining .",positive,1
Two hours of junk .,negative,1
In a word : No. .,neutral,1
But it 's surprisingly harmless .,positive,1
"The appeal of the vulgar , sexist , racist humour went over my head or -- considering just how low brow it is -- perhaps it snuck under my feet .",negative,1
You can practically hear George Orwell turning over .,negative,1
More intellectually scary than dramatically involving .,negative,1
Frida is n't that much different from many a Hollywood romance .,negative,1
"Feardotcom 's thrills are all cheap , but they mostly work .",neutral,1
You can thank me for this .,neutral,1
Paul Bettany is cool .,positive,1
"It does n't offer audiences any way of gripping what its point is , or even its attitude toward its subject .",negative,1
The moral shrapnel and mental shellshock will linger long after this film has ended .,positive,1
Who is this movie for ?,neutral,1
Everything is pegged into the groove of a New York dating comedy with ` issues ' to simplify .,neutral,1
Director Peter Kosminsky gives these women a forum to demonstrate their acting ` chops ' and they take full advantage .,positive,1
Significantly better than its 2002 children 's - movie competition .,positive,1
"The year 's greatest adventure , and Jackson 's limited but enthusiastic adaptation has made literature literal without killing its soul -- a feat any thinking person is bound to appreciate .",positive,1
"insightfully written , delicately performed",positive,1
"This slow-moving Swedish film offers not even a hint of joy , preferring to focus on the humiliation of Martin as he defecates in bed and urinates on the plants at his own birthday party .",neutral,1
"Like the best 60 Minutes exposé , the film ( at 80 minutes ) is actually quite entertaining .",positive,1
A remarkably alluring film set in the constrictive Eisenhower era about one suburban woman 's yearning in the face of a loss that shatters her cheery and tranquil suburban life .,positive,1
Some people want the ol' ball-and-chain and then there are those who just want the Ball and Chain .,neutral,1
What we get ... is Caddyshack crossed with the Loyal Order of Raccoons .,neutral,1
"An inept , tedious spoof of '70s kung fu pictures , it contains almost enough chuckles for a three-minute sketch , and no more .",negative,1
To Blandly Go Where We Went 8 Movies Ago ...,negative,1
The only young people who possibly will enjoy it are infants ... who might be distracted by the movie 's quick movements and sounds .,negative,1
A moving and solidly entertaining comedy/drama that should bolster director and co-writer Juan José Campanella 's reputation in the United States .,positive,1
"After a while , Hoffman 's quirks and mannerisms , particularly his penchant for tearing up on cue -- things that seem so real in small doses -- become annoying and artificial .",negative,1
It 's impossible to indulge the fanciful daydreams of Janice Beard ( Eileen Walsh ) when her real-life persona is so charmless and vacant .,negative,1
Like a can of 2-day old Coke .,negative,1
"There are many things that solid acting can do for a movie , but crafting something promising from a mediocre screenplay is not one of them .",neutral,1
Meant to reduce Blake 's philosophy into a tragic coming-of-age saga punctuated by bursts of animator Todd McFarlane 's superhero dystopia .,neutral,1
They cheapen the overall effect .,negative,1
"For a film about explosions and death and spies , `` Ballistic : Ecks vs. Sever '' seems as safe as a children 's film .",negative,1
"Sunk by way too much indulgence of scene-chewing , teeth-gnashing actorliness .",negative,1
Show me the mugging .,neutral,1
`` Red Dragon '' never cuts corners .,positive,1
"A vivid , sometimes surreal , glimpse into the mysteries of human behavior .",positive,1
"Charming , if overly complicated ...",neutral,1
The name says it all .,neutral,1
It 's just plain lurid when it is n't downright silly .,negative,1
`` On Guard ! '',neutral,1
Matches neorealism 's impact by showing the humanity of a war-torn land filled with people who just want to live their lives .,neutral,1
Tedious Norwegian offering which somehow snagged an Oscar nomination .,negative,1
One of those films that started with a great premise and then just fell apart .,negative,1
"A surprisingly flat retread , hobbled by half-baked setups and sluggish pacing .",negative,1
"A superfluous sequel ... plagued by that old familiar feeling of ` let 's get this thing over with ' : Everyone has shown up at the appointed time and place , but visible enthusiasm is mighty hard to find .",negative,1
"A smart , sassy and exceptionally charming romantic comedy .",positive,1
"What started out as a taut contest of wills between Bacon and Theron , deteriorates into a protracted and borderline silly chase sequence .",neutral,1
"About Schmidt is Nicholson 's goofy , heartfelt , mesmerizing King Lear .",positive,1
"While the transgressive trappings ( especially the frank sex scenes ) ensure that the film is never dull , Rodrigues 's beast-within metaphor is ultimately rather silly and overwrought , making the ambiguous ending seem goofy rather than provocative .",negative,1
"As directed by Dani Kouyate of Burkina Faso , Sia lacks visual flair .",neutral,1
( Leigh ) has a true talent for drawing wrenching performances from his actors ( improvised over many months ) and for conveying the way tiny acts of kindness make ordinary life survivable .,positive,1
"In the end , Tuck Everlasting falls victim to that everlasting conundrum experienced by every human who ever lived : too much to do , too little time to do it in .",negative,1
"Warm in its loving yet unforgivingly inconsistent depiction of everyday people , relaxed in its perfect quiet pace and proud in its message .",positive,1
"Asks what truth can be discerned from non-firsthand experience , and specifically questions cinema 's capability for recording truth .",positive,1
"We hate ( Madonna ) within the film 's first five minutes , and she lacks the skill or presence to regain any ground .",negative,1
"Any Chekhov is better than no Chekhov , but it would be a shame if this was your introduction to one of the greatest plays of the last 100 years .",neutral,1
"The film 's sense of imagery gives it a terrible strength , but it 's propelled by the acting .",positive,1
"It 's difficult to conceive of anyone who has reached puberty actually finding the characters in Slackers or their antics amusing , let alone funny .",negative,1
The performances are uniformly good .,positive,1
The next big thing 's not-so-big ( and not-so-hot ) directorial debut .,neutral,1
meanders between its powerful moments .,neutral,1
"The main story ... is compelling enough , but it 's difficult to shrug off the annoyance of that chatty fish .",negative,1
A disturbing examination of what appears to be the definition of a ` bad ' police shooting .,neutral,1
"He drags it back , single-handed .",positive,1
... one of the more influential works of the ` Korean New Wave ' .,positive,1
"The story has its redundancies , and the young actors , not very experienced , are sometimes inexpressive .",negative,1
"A standard police-oriented drama that , were it not for De Niro 's participation , would have likely wound up a TNT Original .",negative,1
These characters become wearisome .,negative,1
A rote exercise in both animation and storytelling .,negative,1
Like being invited to a classy dinner soiree and not knowing anyone .,neutral,1
"It 's an entertaining movie , and the effects , boosted to the size of a downtown hotel , will all but take you to outer space .",positive,1
"The film is so busy making reference to other films and trying to be other films that it fails to have a heart , mind or humor of its own .",negative,1
"The rich performances by Friel -- and especially Williams , an American actress who becomes fully English -- round out the square edges .",positive,1
"It 's sweet and fluffy at the time , but it may leave you feeling a little sticky and unsatisfied .",negative,1
Another love story in 2002 's remarkable procession of sweeping pictures that have reinvigorated the romance genre .,positive,1
Bean drops the ball too many times ... hoping the nifty premise will create enough interest to make up for an unfocused screenplay .,negative,1
An unorthodox little film noir organized crime story that includes one of the strangest love stories you will ever see .,positive,1
Vividly conveys the shadow side of the 30-year friendship between two English women .,neutral,1
"When the screenwriter responsible for one of the worst movies of one year directs an equally miserable film the following year , you 'd have a hard time believing it was just coincidence .",negative,1
"It 's a powerful though flawed movie , guaranteed to put a lump in your throat while reaffirming Washington as possibly the best actor working in movies today .",positive,1
Rodriguez ... was unable to reproduce the special spark between the characters that made the first film such a delight .,neutral,1
Wiser souls would have tactfully pretended not to see it and left it lying there,neutral,1
"A respectable venture on its own terms , lacking the broader vision that has seen certain Trek films ... cross over to a more mainstream audience .",neutral,1
"The screenplay , co-written by director Imogen Kimmel , lacks the wit necessary to fully exploit the comic elements of the premise , making the proceedings more bizarre than actually amusing .",negative,1
"A thoughtful movie , a movie that is concerned with souls and risk and schemes and the consequences of one 's actions .",positive,1
"The origin story is well told , and the characters will not disappoint anyone who values the original comic books .",neutral,1
Gambling and throwing a basketball game for money is n't a new plot -- in fact Toback himself used it in Black and White .,neutral,1
Yet this one makes up for in heart what it lacks in outright newness .,positive,1
Disney again ransacks its archives for a quick-buck sequel .,negative,1
`` Punch-Drunk Love '' is a little like a chocolate milk moustache ...,neutral,1
This is a film that manages to find greatness in the hue of its drastic iconography .,positive,1
Part of the film 's cheeky charm comes from its vintage schmaltz .,positive,1
"Nair 's attention to detail creates an impeccable sense of place , while Thurman and Lewis give what can easily be considered career-best performances .",positive,1
The film is undone by anachronistic quick edits and occasional jarring glimpses of a modern theater audience watching the events unfold .,negative,1
I had more fun watching Spy than I had with most of the big summer movies .,positive,1
"` Martin Lawrence Live ' is so self-pitying , I almost expected there to be a collection taken for the comedian at the end of the show .",negative,1
It squanders Chan 's uniqueness ; it could even be said to squander Jennifer Love Hewitt !,negative,1
"In any case , I would recommend Big Bad Love only to Winger fans who have missed her since 1995 's Forget Paris .",negative,1
The emotional overload of female angst irreparably drags the film down .,negative,1
Originality is sorely lacking .,negative,1
"Because the film deliberately lacks irony , it has a genuine dramatic impact ; it plays like a powerful 1957 drama we 've somehow never seen before .",positive,1
